Organization	URL	H1	MetaTitle	MetaDescription	NavItems	CTAs	DonateURL	DonationProvider	NewsletterURL	EventsURL	StaffBoardURL	Facebook	Instagram	YouTube	LinkedIn	Status
Name	Website															"Error: Page.goto: Protocol error (Page.navigate): Cannot navigate to invalid URL
Call log:
  - navigating t"
Groundswell	https://groundswellconservancy.org/	Protect Special Places, Forever	Groundswell Conservancy - Protect Special Places, Forever	Groundswell Conservancy is a Wisconsin nonprofit land trust. We believe you deserve a world filled with green places where communities thrive.	Skip Navigation | Who We Are | Mission | History | Staff | Board of Directors | Contact Us | What We Do | Act On Climate Crisis | Connect People With Nature | Conserve Wildlife Habitat | Provide Equitable Access to Land | Keep Farmland, Farmland | Create Green Schoolyards | Get Involved	more ways to give, outdoor volunteering, learn more about volunteering, donate, donate with confidence, ways to give	https://groundswellconservancy.org/donate/	Other	https://groundswellconservancy.org/news/newsletters/	https://groundswellconservancy.org/events/	https://groundswellconservancy.org/who-we-are/board-of-directors/	https://www.facebook.com/groundswell.wi/	https://scontent-iad3-2.cdninstagram.com/v/t39.30808-6/544811637_1181651890671903_107283176895501434_n.jpg?stp=dst-jpg_e35_tt6&_nc_cat=106&ccb=1-7&_nc_sid=18de74&_nc_ohc=pZgCn1wwY00Q7kNvwGc599g&_nc_oc=AdlcZ39GBkUwUY4Wxv5ZMeh6rJBsUQojbOoC9botRG3RZ9JSpoHHDZMKheUeuzOq0h4&_nc_zt=23&_nc_ht=scontent-iad3-2.cdninstagram.com&edm=ANo9K5cEAAAA&_nc_gid=fa1lMrIO2yE6Y2NQ1zJndg&oh=00_AfZ4ey8M_dq1Z6chtPf6r2lJY9QTh3PaBGLMEgg2CphQ0w&oe=68C90675		https://www.linkedin.com/company/groundswell-conservancy	OK
Ice Age Trail	https://www.iceagetrail.org/	Explore the Trail	Ice Age National Scenic Trail Wisconsin | Ice Age Alliance	Our mission is to conserve, create, maintain, & promote the Ice Age National Scenic Trail. Become a member to support our mission & get members-only perks.	Ice Age Trail Alliance | Email Signup | Members | Trail Map | Donate | Shop | Explore | Discover the Trail | Interactive Map | Segment by Segment Tour | Ice Age Trail Facts | Trail Communities | Mammoth Hike Challenge | Trailtessa Retreats | Ways to Enjoy the Trail	help ensure the ice age trail is here for generations to come. donate today. ►, maintenance sweep volunteers care for the lake eleven segment, join the ice age trail alliance to support our mission and get members-only perks. ►, member & volunteer resources, volunteer, volunteer spotlight: steve larson!, volunteer spotlight: mark graczykowski!, trail shuttles and volunteer help, volunteer spotlight: patti herman!, volunteer spotlight: amanda fischer!, volunteers craft a mile of brand-new trail!, donate, get involved!become a volunteer., volunteer spotlight: jenny gramer!, donate to iata, iata member or volunteer? access important news & info here. ►, other ways to give, ways to give	https://www.iceagetrail.org/get-involved/contribute/	Other		https://www.iceagetrail.org/trailbuilding-blue-hills-may-2025/	https://www.iceagetrail.org/iata/history/board-directors/	https://www.facebook.com/iceagetrail	https://instagram.com/iceagetrailorg			OK
Driftless	https://www.driftlessconservancy.org/	Conservation. Care. Connection.	Driftless Area Land Conservancy, The Land Trust for Southwest Wisconsin	Driftless Area Land Conservancy's purpose is to maintain and enhance the health, diversity and beauty of Southwest Wisconsin's natural and agricultural landscape through permanent land protection and restoration, and improve people's lives by connecting them to the land and to each other.	DONATE | CALENDAR OF EVENTS | HOME | Land Protection | Ambassador Properties | Our Energy Future | Driftless Trail | Lowery Creek Watershed | Southern Driftless Grasslands | Transmission Line Opposition | Protect Your Land | Manage Your Land | Find an Event & Register | Volunteer | Latest News	volunteer, give today, join the legacy society, donate, ways to give	https://www.driftlessconservancy.org/give-today	Other	https://www.driftlessconservancy.org/newsletter	https://www.driftlessconservancy.org/calendar-of-events	https://www.driftlessconservancy.org/our-board	https://www.facebook.com/driftlessconservancy	https://www.instagram.com/driftless_dalc/	https://www.youtube.com/channel/UCVA-I8CGn-XqahF6GD5GSTA/		OK
SW Wisc Birds	https://swibirds.org/		Southern Wisconsin Bird Alliance (formerly Madison Audubon)	"Southern Wisconsin Bird Alliance (formerly Madison Audubon) is 
south-central Wisconsin's chapter of the National Audubon Society. We know 
that birds make life better, in south-central Wisconsin and beyond. Become 
a Southern Wisconsin Bird Alliance member today and help share the joy of 
birds."	Translate | What we do | Who we are | Our New Name | Bird & Nature Blog | Newsletters & Reports | Commitment to Equity & Inclusion | Relationship to National | Our Partners | Community Standards | Contact Us | Friday Feathered Features | All About Birding | Entryway to Birding Blog | Who's That Singing?	volunteer, join, donate  today!, renew, renewable energy projects, support birds, habitats, and kids, ways to give	/donate	Other	/newsletters-reports	/events		http://facebook.com/swibirds/	http://instagram.com/swibirds	https://www.youtube.com/@SWiBirds		OK
Tall Pines	https://tallpinesconservancy.org/		Home		Blog | Contact | Gallery | About | Home | About us | News | our work | WHY PROTECT LAND | Home | WAYS TO GIVE | Donate | Contact us | GET INVOLVED | + Events Home	join our mailing list, donate, events & volunteer, thank you to our corporate supporters, ways to give	https://www.paypal.com/cgi-bin/webscr?cmd=_s-xclick&hosted_button_id=SBCH7Z3DNX5QG&source=url	PayPal		/get-involved	/meet-the-board	https://www.facebook.com/Tall-Pines-Conservancy-332276452045/	https://www.instagram.com/tall_pines_conservancy/?hl=en	https://www.youtube.com/user/TallPinesConservancy		OK
Northwoods LT	https://northwoodslandtrust.org/	Leaving a Legacy of Land for the Northwoods	Northwoods Land Trust		Skip to content | AboutUs | Our History | Our Service & Focus Areas | Old-Growth Forest Initiative | Shoreland Protection Initiative | Climate Conservation Solutions Initiative | FAQs | ConservedLands | ProtectYour Land | SupportNWLT | Northwoods Legacy Society | OurPublications | Publications Archive | News& Events	support nwlt, donate, supportnwlt, volunteer day at holmboe conifer forest	https://northwoodslandtrust.org/support-nwlt/donation-form/	Other	#elementor-action%3Aaction%3Dpopup%3Aopen%26settings%3DeyJpZCI6IjE0MDQiLCJ0b2dnbGUiOmZhbHNlfQ%3D%3D	https://northwoodslandtrust.org/event/hike-at-beaver-creek-hemlocks/		https://www.facebook.com/NorthwoodsLandTrust/	https://www.instagram.com/northwoods_land_trust/?hl=bg	https://www.youtube.com/@northwoodslandtrust6460		OK
Prairie Enthusists	https://theprairieenthusiasts.org/	PRAIRIES NEED YOUR CARE	Prairie Enthusiasts | Save Your Local Rare Habitats		About Us | Mission | Who We Are | Business | Contact Us | FAQ | Work With Us! | Our Chapters | Find your chapter | Chippewa Savannas | Coulee Region | Empire-Sauk | Glacial Prairie | Many Rivers | Minnesota Driftless	more ways to give, volunteering, donate, volunteer	https://secure.qgiv.com/for/theprairieenthusiasts/	Qgiv		https://theprairieenthusiasts.org/tpe-events/events-calendar/		https://www.facebook.com/ThePrairieEnthusiasts	https://www.instagram.com/theprairieenthusiasts/	https://www.youtube.com/@theprairieenthusiasts350		OK
Gathering Waters	https://gatheringwaters.org/		Gathering Waters – Wisconsin's Alliance for Land Trusts		Skip to content | Donate | About Us | Who We Are | What We Do | Publications | Support Us | Donate | Ways To Give | Your Trust Matters | Your Impact & Thanks | Legacy Giving | Monthly Giving | About Wisconsin Land Trusts | What Is A Land Trust	donate, ways to give	https://gatheringwaters.org/ways-to-give/donate/	Other	https://secure.lglforms.com/form_engine/s/MoAxbLqlP_xcwBBvwT-WoQ	webcal://gatheringwaters.org/?post_type=tribe_events&ical=1&eventDisplay=list	https://gatheringwaters.org/about/who-we-are/	https://www.facebook.com/GatheringWatersWI/	https://www.instagram.com/gatheringwaters/		https://www.linkedin.com/company/gathering-waters-conservancy/about/	OK
Ozaukee Washington LT	https://www.owlt.org/	Want to have an event on a Restoring Lands Nature Preserve? Click here!	Restoring Lands: A Wisconsin Land Trust	The mission of Restoring Lands is to protect, connect, and restore southeast Wisconsin's lands and waters for the benefit of all.	EVENTS | STORE | DONATE | HOME | PRESERVES | SUPPORT | GET INVOLVED | CALENDAR OF EVENTS | BETTER TOGETHER: A WATERSHED MOMENT | BOARD & COMMITTEE APPLICATION | VOLUNTEER | COMMUNITY SCIENCE | EMPLOYMENT OPPORTUNITIES | NEWS | DIGITAL eNEWS	volunteer, donate, support	https://www.restoringlands.org/donate	Other	https://www.restoringlands.org/newsletter	https://www.restoringlands.org/_files/ugd/6746cd_1f58ea3cefc047eba64be95acfe436fe.pdf	https://www.restoringlands.org/board	https://www.facebook.com/restoringlandswi/	https://www.instagram.com/restoringlandswi/	https://www.youtube.com/channel/UCFW7IgqFkxwYH3NAK9u44TQ	https://www.linkedin.com/company/restoringlandswi//	OK
Ridges	https://ridgessanctuary.org/	More than a walk in the woods	The Ridges Sanctuary – Preservation, Education, and Research - The Ridges Sanctuary		Skip to content | Trail Pass | Donate | The Ridges Sanctuary | Explore | Hike the Ridges | Maps | Hours + Policies | Accessibility | Indigenous Heritage | Events & Programs | Event Calendar | Summer Camps | Festival Of Nature | Free Fridays	join, donate, volunteer	https://ridgessanctuary.org/ways-to-give/	Other		https://ridgessanctuary.org/events	https://ridgessanctuary.org/staff/	https://www.facebook.com/RidgesSanctuary	https://www.instagram.com/ridgessanctuary/	https://www.youtube.com/@TheRidgesSanctuary	https://www.linkedin.com/company/the-ridges-sanctuary-inc/	OK
Kinnickinnic River	https://www.kinniriver.org/	Kinnickinnic River Land Trust	Kinnickinnic River Land Trust - Working with the community to conserve and protect the beauty and health of the Kinnickinnic River and its watershed.	The Kinnickinnic River Land Trust is a nonprofit conservation organization that has protected the Kinnickinnic River Watershed since 1993. Through land acquisition, conservation easements, and collaboration with the community, we create a lasting future for the Kinnickinnic River. Based in River Falls, Wisconsin. (715) 425-5738	Kinnickinnic | River Land Trust | About | Events | Nature Fest | News | Protect Your Land | Search | Nature Preserves | Ecology | Current Kinni River Conditions | Other Places to Visit | Watershed Tours | Find Your Flock | Kinni Explorers	ways to support, donate, join our email list to get updates about krlt events, news and ways to support!	https://interland3.donorperfect.net/weblink/WebLink.aspx?name=E358470&id=32	DonorPerfect		https://www.kinniriver.org/ways-to-support-kinnickinnic-river-land-trust		https://www.facebook.com/304536836438	https://www.instagram.com/kinnickinnic_river_land_trust/	https://www.youtube.com/channel/UCHdX7n0eAGnxwJ3piScHB0Q		OK
Glacial Lakes	https://www.glaciallakes.org/		Home	Glacial Lakes Conservancy, Inc. is a private, non-profit land conservation organization, prompting a deep concern for the future of our region’s lands and waters.	Home | Who We Are | What We Do | Resources | Contact Us | Donate | EVENTS | Protected Properties | Newsletters | Volunteer Opportunities | Youth Education | Membership | GLC Event Sponsors | 2025 Land Trust Days | Plant Sale	volunteer opportunities, donate today, donate	/donate.html	Other	/newsletters.html	/photos-from-previous-events.html		https://www.facebook.com/pages/Glacial-Lakes-Conservancy/265599060270924	https://www.instagram.com/glacial.lakes/?hl=en			OK
Mississippi Valley	https://mississippivalleyconservancy.org/	Conservation for life	Conservation for life | Mississippi Valley Conservancy		Menu | About Us | Open submenu | Land Protection | Open submenu | Climate Change | Open submenu | Get Involved | Open submenu | Wild Reads | Resources | Open submenu | Events & Programs | Open submenu | Ways to Give	give from your ira, volunteer, donate real estate, donate a conservation easement, donate, donate stock, ways to give	https://www.mississippivalleyconservancy.org/ways-give/give-single-or-monthly-donation	Other	https://visitor.r20.constantcontact.com/d.jsp?llr=9wb84fcab&p=oi&m=9wb84fcab&sit=cku5ryxcb&f=58ee63dd-acfd-4985-8ef5-7e6072f4d941	/events	/about-us/our-staff	https://www.facebook.com/Mississippi-Valley-Conservancy-222430287164/	https://www.instagram.com/mississippi_valley_conservancy/	https://www.youtube.com/user/BluffConservancy		OK
Baird Creek	https://bairdcreek.org/	Endangered Rusty Patched Bumblebee Project														Error: 'NoneType' object has no attribute 'strip'
Midwest Environmental Advocates	https://midwestadvocates.org/		Midwest Environmental Advocates | Legal Services | Policy & Advocacy | Organizing | Wisconsin	The mission of Midwest Environmental Advocates (MEA) is to secure and protect the rights of all people to healthy water, land, and air.	Skip to content | En Español | Hmoob | DONATE | About | Mission & Impact | Our Team | Clients & Partners | Financials | Careers | Clerkships | Contact Us | Our Work | Legal Action | Policy & Advocacy	join us on september 28 for the wisconsin climate march!, donate, volunteer, ways to give	https://midwestadvocates.org/ways-to-give/	Other	https://mea.app.neoncrm.com/forms/newsletter-signup	https://midwestadvocates.org/news-events/	https://midwestadvocates.org/about/team/	https://www.facebook.com/MidwestEnvironmentalAdvocates	https://www.instagram.com/midwestadvocates/	https://www.youtube.com/@midwestenvironmentaladvoca6119		OK
Landmark	https://landmarkwi.org/		Landmark Conservancy Home - Landmark Conservancy	Protect your land for future generations! We are a non-profit, Wisconsin-based land conservation organization serving western and northwestern Wisconsin.	× |  |  |  | Contact | Donate | Home | About | Land Protection | News | Events | Get Outside! | Support Us | Home | About	support us, give with confidence, donate, support our mission	https://landmarkwi.org/support-us/	Other	https://visitor.r20.constantcontact.com/d.jsp?llr=b4aburmab&p=oi&m=1112987960289&sit=o8k7tvxhb&f=b810da98-7ca0-49ec-9603-d1c751ea71b3	https://landmarkwi.org/events/	https://landmarkwi.org/category/board-member-feature/	https://www.facebook.com/LandmarkConservancyWI/	https://www.instagram.com/landmarkwisconsin/	https://www.youtube.com/@landmarkconservancy413		OK
NEW LT	https://www.newlt.org/	Home	Northeast Wisconsin Land Trust		Support Our Mission | Login | About | Our Impact | Strategic Plan | Our Staff | Our Board | News & Media | Credentials | Contact Us | How We Protect Land | Conservation Plan | Protect Your Land | Private Lands | Climate Change Statement	volunteer with us, volunteer, support our mission, donate now, donate	https://form-renderer-app.donorperfect.io/give/northeast-wisconsin-land-trust/standard-donor-form	DonorPerfect		https://newlt.org/upcoming-events/	https://newlt.org/board/	https://www.facebook.com/newlt.org/	https://www.instagram.com/newisconsinlandtrust/	https://www.youtube.com/@northeastwisconsinlandtrus7389	https://www.linkedin.com/company/northeast-wisconsin-land-trust	OK
Kettle Moraine LT	https://kmlandtrust.org/		Kettle Moraine Land Trust – Serving the southern Kettle Moraine lakes area in Walworth County, Wisconsin		Land Protection | Our Preserves | Beulah Bluff Preserve | Jackson Creek Preserve | Petersen Island Woods Preserve | Turtle Creek Preserve | Putra-Scharff Preserve | Conservation Easements | Hartranft Easements | Lauderdale Lakes Country Club Easement | Adelman & Schwartz Easement | Benes Easement | Partnership Properties | Wisconsin Department of Natural Resources | Walworth County Parks	donate – give to nature, volunteer, donate now	https://kmlandtrust.org/donate-give-to-nature/	Other	https://kmlandtrust.org/newsletters/	https://kmlandtrust.org/event/beulah-bluff-pop-up-workday/	https://kmlandtrust.org/board-and-staff/	https://www.facebook.com/KettleMoraineLandTrust/			https://www.linkedin.com/company-beta/15529284/	OK
Cedar Lake	https://theclcf.org/	We’re here to conserve the natural environment of Wisconsin’s Cedar Lakes region.	Home | Cedar Lakes Conservation Foundation	Cedar Lakes Conservation Foundation is committed to the preservation of wetlands and woodlands in the Cedar Lakes region in Wisconsin.	Skip to content | About Us | History & Mission | Our Impact | Meet the Team | Meet the Board | Protect Your Land | Preserves & Trails | Guidelines for Preserves & Trails | Fox Hill Nature Preserve | Lockman Property | Joan M. Pick Nature Preserve | Polk Kames | Rudorf Farm | Thoma Preserve	support us, from executive director, linda mutschler back in december 2016, while serving on clcf’s board, i volunteered to step in as interim project manager to help…, donate, volunteer	https://theclcf.org/make-a-donation/	Other	https://theclcf.org/resources/newsletter/	https://theclcf.org/category/activities-events/	https://theclcf.org/sabbatical/	https://www.facebook.com/theclcf	https://www.instagram.com/theclcf	https://www.youtube.com/@theclcf		OK
Geneva Lake	https://www.genevalakeconservancy.org/	Let'sConnect	Geneva Lake Conservancy | Protecting Lands & Waterways	Geneva Lake Conservancy is a 501(c)(3) nonprofit organization that works to protect  and restore the lands and waterways of Walworth County and beyond.	Donate | Home | WHO WE ARE | About | Our History | Our Mission | Board Of Directors / Staff | EVENTS | Calendar | Events | LAKE PROTECTION | LAND PROTECTION | PROGRAMS | Conservation@Home | Conservation@Work	donate, volunteer, ways to donate	https://give.genevalakeconservancy.org/campaign/657112/donate	Other	https://www.genevalakeconservancy.org/contact-us	https://www.genevalakeconservancy.org/registration	https://www.genevalakeconservancy.org/board-of-directors	https://www.facebook.com/GenevaLakeConservancy/	https://www.instagram.com/genevalakeconservancy/	https://www.youtube.com/watch?v=bsEnu31vJ3o		OK
North Central CT	https://www.ncctwi.org/	Protecting Special Places In Central Wisconsin	North Central Conservancy Trust	A Land Trust Protecting Special Places In Central Wisconsin North Central Conservancy Trust is a nonprofit organization. We protect land and natural resources in Central Wisconsin for the benefit of the environment and our community. Read More MISSION STATEMENT: Conserving the natural heritage of Central Wisconsin through the protection of land. CONSERVATION IMPACT: Acres Protected	Skip to content | BECOME A MEMBER | NEWS | CONTACT US | HOME | ABOUT US | History & Mission | What We Do | Accreditation | Protected Lands | Service Area Maps | Our Board | Our Staff | Our Sponsors | Our Partners	volunteering & events, join, 30 acres donated to ncct on big cain creek, volunteer opportunities, donate, renew, please give a warm welcome to our newest ncct board member, pat mcmurtrie!, support ncct, ways to give	https://www.ncctwi.org/donate/	Other	http://eepurl.com/gk8Ngn	https://www.ncctwi.org/category/events/spring-events/	https://www.ncctwi.org/please-give-a-warm-welcome-to-our-newest-ncct-board-member-pat-mcmurtrie/	https://www.facebook.com/ncctwi/	https://www.instagram.com/ncct_landtrust/	https://www.youtube.com/@northcentralconservancytru279		OK
Knowles-Nelson	https://knowlesnelson.org/	the Knowles-Nelson Stewardship program	Knowles Nelson Stewardship – Protecting Land and Water in Wisconsin		Skip to content | About | About Knowles-Nelson | FAQs & Myths | Contact Us | News | Knowles-Nelson in the News | Team Knowles Nelson Updates | Take Action | Explore Toolkit | Impact | Conservation Projects | Research | Natural Infrastructure | How Nature Works For Us	join ussign up for team knowles-nelson to receive action alerts and keep up to date on the budget debate.join now					https://knowlesnelson.org/team-knowles-nelson/	https://www.facebook.com/GatheringWatersWI/	https://www.instagram.com/gatheringwaters/			OK
Land Trust Alliance	https://landtrustalliance.org/		Land Trust Alliance		Why Land Matters | Why Land Matters | Land conservation | About land trusts | What's at stake | Land is the answer | About private land conservation | Conservation priorities | Clean water | Climate change | Equitable land access | Future generations | Family farms and ranches | Habitat conservation | Healthy communities	volunteer, supporting land trusts, supporter benefits, donate now, donate, give, give monthly, join stewards of the land, land trusts with volunteer opportunities, ways to give	https://gaininggroundusa.donorsupport.co/-/XXYZQDKS	Other			/job-board	https://facebook.com/landtrustalliance	https://instagram.com/ltalliance	https://youtube.com/user/LandTrustAlliance	https://linkedin.com/company/land-trust-alliance	OK
Natural Lands Pennsylvania	https://natlands.org/	land for life. nature for all.	Natural Lands | Land for Life. Nature for All.	Natural Lands. Land for Life, Nature for All. Saving open space, caring for nature, and connecting people to the outdoors and each other. Land conservation in Pennsylvania and New Jersey.	nature preserves to explore | Stoneleigh:a natural garden | view all | map | support these places | days & hours | accessibility | trail maps for your smartphone | dos & don'ts | dog rules | photography | deer management | make a date with natureWith 23,000+ acres of land across two states and 13 counties, there’s a lot to explore. | events & news | general events	volunteer – nurture nature, find yourself outsidefrom yoga to bird walks to volunteering, we offer events year-round., ways to volunteer, donate nowmore than ever, “forever” depends on what we do today. together we can make a difference., renew membership, volunteer events, support these places, sell or donate your land, join/renew, volunteer day at sadsbury woods, donate, volunteer – care for nature, corporate volunteering, other ways to give, upcoming volunteer events	https://www.natlands.org/donate/	Other		https://wp.natlands.org/events/category/general/	https://www.natlands.org/what-we-do/about-us/staff-leadership/	https://www.facebook.com/NatLands/	https://www.instagram.com/natural.lands		https://www.linkedin.com/company/natural-lands/	OK
Columbia LT	https://www.columbialandtrust.org/		Conserving The Nature You Love - Columbia Land Trust		Columbia Land Trust on Instagram | Columbia Land Trust on Facebook | Columbia Land Trust on YouTube | Events | Our Conservation Agenda | Donate | Columbia Land Trust | Our Work | News | Ways To Give | Get Involved | About Us | WHAT WE DO | Featured StorySpring/Summer 2025 Fieldbook | Featured StoryWatch “Restoring Wildboy Creek” about Kwoneesum Dam removal	give a gift, donate, ways to give	https://www.columbialandtrust.org/donate/	Other	/newsletter-signup/	/news/events/		https://www.facebook.com/pages/Columbia-Land-Trust/53230984733	http://instagram.com/columbialandtrust	http://www.youtube.com/channel/UCie00CEFdbTKPZ0i6WQuHzQ		OK
Central Indiana LT	https://conservingindiana.org/	Saving Nature, Awakening Wonder	Homepage - Central Indiana Land Trust	Central Indiana Land Trust, Inc. (CILTI) preserves the best of Central Indiana’s natural areas so all can experience the wonder of the state’s natural heritage.	Skip to content | Volunteer | Email Signup | Donate | Homepage | Preserves | Burnett Woods Nature Preserve | Fred and Dorothy Meyer Nature Preserve | Jacob Schramm Nature Preserve | Laura Hare Preserve at Blossom Hollow | Meltzer Woods | Nonie Werbe Krauss Nature Preserve | Oliver’s Woods | Wallace F. Holladay Preserve at Ameriplex | Betley Woods at Glacier’s End	donate today, volunteer, donate to cilti, donate, tax-efficient ways to give, ways to give	/donate-to-cilti/	Other	https://conservingindiana.org/e-newsletter-archive/	/events		https://www.facebook.com/conservingindiana/	https://www.instagram.com/centralindianalandtrust/	https://www.youtube.com/@centralindianalandtrust8410	https://www.linkedin.com/company/central-indiana-land-trust-inc	OK
Low Country LT	https://lowcountrylandtrust.org/		Conservation Organization in Charleston, SC	Lowcountry Land Trust is a conservation organization protecting land in South Carolina through easements, education & community programs.	Skip to content | DONATE | subscribe | What We Do | Protecting Land and Water Forever | Conservation Easements | Land Stewardship | Publicly-Accessible Places | Angel Oak Preserve | Sustaining the Soul of the Lowcountry | News | The Ebb & Flow Blog | Email Newsletter Signup | Latest Impact Report | Events	volunteer opportunities, click here to donate, donate	https://lowcountrylandtrust.org/donate/donation-form/	Other	https://lowcountrylandtrust.org/subscribe-1/	https://lowcountrylandtrust.org/home/sustaining-the-soul-of-the-lowcountry/	https://lowcountrylandtrust.org/staff-and-board/lowcountry-land-trust-staff-updates/	https://www.facebook.com/lowcountrylandtrust	https://www.instagram.com/lowcountrylandtrust	https://www.youtube.com/watch?v=-e4tgPLLLoM&list=PLYQzCpYDTEmca79MIK3BBQ13GAdXgkLhR&pp=gAQBiAQB	https://www.linkedin.com/company/lowcountry-land-trust-inc/	OK
