Organization	URL	H1	MetaTitle	MetaDescription	NavItems	CTAs	DonateURL	DonationProvider	NewsletterURL	EventsURL	StaffBoardURL	Facebook	Instagram	YouTube	LinkedIn	Status
Nature Conservancy	https://www.nature.org/en-us/	The Nature Conservancy	The Nature Conservancy: A World Where People & Nature Thrive	We're working around the world to protect the lands and waters on which all life depends and fight climate change. Join us.	Give Now. | interstitialRedirectModalRedirectCTA | interstitialRedirectModalDismissCTA | Skip to content | English | Español | Donate | What We Do | What We Do | Our Priorities | Tackle Climate Change | Protect Ocean, Land & Fresh Water | Provide Food and Water | Our Insights | Perspectives	give now., volunteer, donate now, donate to our mission, renew, donate, give monthly, give, nature labnature lab is our hub for youth curriculum that gives teachers, students and families customizable, interactive lesson plans to explore and understand nature., other ways to give	/en-us/donateredirect/support-nature/	Other	https://www.natureaustralia.org.au/about-us/sign-up-for-email-updates/	/en-us/get-involved/how-to-help/events/		https://www.facebook.com/thenatureconservancy	https://www.instagram.com/nature_org/	https://www.youtube.com/user/natureconservancy	https://www.linkedin.com/company/the-nature-conservancy/	OK
Aldo Leopold Foundation	https://www.aldoleopold.org/	Where Ethics Meet Earth	The Aldo Leopold Foundation | Where Ethics Meet Earth	Discover where ethics meet earth. Learn about Aldo Leopold's legacy, a Land Ethic®, and our conservation efforts at the Aldo Leopold Foundation.	Crane tours are available. Book yours now! | our work | mission & Vision | The Land Ethic | aldo leopold | The Land Ethic® | Land Ethic® in action | hours & location | tours | leopold-pines conservation area | contact us | learning hub | leopold archives | Leopold Fellowships | Land Ethic® in Action	support our work, volunteer, more ways to give, support our workyour support upholds and advances our mission of environmental stewardship. we deeply appreciate every contribution and invite you to join our mission by giving today., join our newsletter, donate, join the newsletter, join & support	/donate/one-time-sa-donate	Other	/join-and-support/newsletter-sign-up	/visit/tours	/about/board-of-directors	https://www.facebook.com/AldoLeopoldFoundation/?ref=bookmarks	https://www.instagram.com/aldoleopoldfoundation/	https://www.youtube.com/channel/UCbDUto-7-ynE90cOjudYGXQ	https://www.linkedin.com/company/aldo-leopold-foundation/	OK
Conservation MN	https://www.conservationminnesota.org/	ProtectThe Minnesota You Love	Home | Conservation MN		Skip to main content | Conservation MN | What We Do | Biggest Wins | Our Team | Partners | Financials | Jobs | Contact Us | ImageWater | ImageLand | ImageWaste & Toxics | ImageGroupCreated with Sketch.Climate & Energy | Events | News & Insights	donate, donate now, ways to give	/donate	Other	https://www.conservationminnesota.org/news/summer-2025-newsletter	/happening-now/events	/about-us/our-team	http://www.facebook.com/pages/Conservation-Minnesota/15650561930?ref=ts	https://www.instagram.com/conservationminnesota/?hl=en	http://www.youtube.com/user/ConservationMinn		OK
Belwin Conservancy	https://belwin.org/		Belwin Conservancy		Skip to Content | Skip to navigation | About | Mission & Values | Impact: Land & People | Land Acknowledgement | History | Reports & Finances | Staff & Board | Jobs & Opportunities | Blog | Contact | Staff | Events | Español	volunteer, more ways to give, join us, donate, donate online now	https://belwin.org/involved/donate/	Other	https://www.tfaforms.com/4860355	/events	https://belwin.org/about/board-staff/	https://www.facebook.com/belwinconservancy/	https://www.instagram.com/belwinconservancy/	https://www.youtube.com/channel/UC4fZFFDIsSc9OnqTGsp3oGQ		OK
Green Bay Botanical Gardens	https://www.gbbg.org/	Open Daily	Green Bay Botanical Garden	Open Daily 9 am-6:30 pm Plan Your Visit Hours & Daily Admission Saturday, September 27Celebrate our anniversary and the Garden’s deep roots in the community! event Details Upcoming Happenings View Full Calendar About Us Get ready for a show-stopping adventure as you explore 47 acres filled with more than 120,000…	Skip to content | Tickets | Donate | Membership | Account | Visit | Plan Your Visit | Hours & Daily Admission | Calendar | Garden Map | WPS Trellis Gift Shop | Contact Us | Explore | Events & Exhibits | Weddings & Other Rentals	volunteer, support, give a gift, renew membership, donate, join now	https://www.gbbg.org/support/donate/	Other	https://www.gbbg.org/garden-newsletters/	https://www.gbbg.org/visit/calendar/	https://www.gbbg.org/board-of-directors/	https://www.facebook.com/GreenBayBotanicalGarden	https://www.instagram.com/gbbotanicalgarden/		https://www.linkedin.com/company/green-bay-botanical-garden/posts/?feedView=all	OK
Woodland Dunes	https://www.woodlanddunes.org/	Adventure Awaits	Woodland Dunes Nature Center & Preserve		Skip to content | Open toolbarAccessibility Tools | Increase TextIncrease Text | Decrease TextDecrease Text | GrayscaleGrayscale | High ContrastHigh Contrast | Negative ContrastNegative Contrast | Light BackgroundLight Background | Links UnderlineLinks Underline | Readable FontReadable Font | ResetReset | Skip to primary navigation | Skip to main content | Home | About	support, volunteer opportunities, continue readingvolunteer opportunities, donate, continue readingdonate	https://www.woodlanddunes.org/support/donate/	Other		https://www.woodlanddunes.org/calendar/	https://www.woodlanddunes.org/about/board-of-directors/	https://www.facebook.com/profile.php?id=100064917630306		https://www.youtube.com/@woodlanddunesnaturecenterp7507		OK
Standing Cedars	https://standingcedars.org/	We Are Standing Cedars	Standing Cedars Land Trust		Skip to content | AboutUs | Land inConservancy | Engelwood | Tewksbury | Buffalo Skull | Brown | ProtectYour Land | SupportOur Work | News& Events | Volunteer | ContactUs | AboutUs | Land inConservancy | Engelwood	support our work, volunteerlearn about volunteering at standing cedarssign up, volunteer, donate now, donate, supportour work	https://www.mightycause.com/organization/Standing-Cedars-Community-Land-Conservancy	Other		https://standingcedars.org/news-events/						OK
Crossroads at Big Creek	https://crossroadsatbigcreek.org/	COME EXPLORE...	Home - Crossroads at Big Creek	Welcome to Crossroads at Big Creek, a 200-acre nature preserve and learning center located in Sturgeon Bay, Wisconsin.	Skip to content | About | Mission And Values | Our People | Facilities | Events | Calendar | Field Trips | Recurring Events | Junior Nature Club | Explore | Big Creek | The Cove | Ida Bay | Restoration	volunteer appreciation night, volunteer, donate now, volunteer opportunities, give	https://crossroadsatbigcreek.org/become-involved/give/	Other	http://crossroadsatbigcreek.org/wp-content/uploads/2025/03/Spring-2025-Email-Newsletter.pdf	https://crossroadsatbigcreek.org/events-calendar/		https://www.facebook.com/CrossroadsAtBigCreek	https://www.instagram.com/crossroadsatbigcreek/			OK
River Edge Nature Center	https://riveredgenaturecenter.org/	A new kind ofnaturecenter	Riveredge Nature Center		Skip to content | Help us renovate the Visitor Center and create an accessible trail loop!! | Visit | Plan a Visit | Hours and Fees | Maps and Directions | VENUE RENTALS | Accessibility at Riveredge | All-Terrain Wheelchair | Calendar | Programs | About | Mission, Vision, Values | Our History | Board	volunteer, join, give, donate, join our team, ways to give	https://secure.riveredgenaturecenter.org/forms/donate	Other		https://riveredgenaturecenter.org/events/	https://riveredgenaturecenter.org/staff/	https://www.facebook.com/riveredgenaturecenter/	https://www.instagram.com/riveredgenaturecenter/	https://www.youtube.com/channel/UCwaOkZYuVLjta80vSxSHMBw	https://www.linkedin.com/company/riveredge-nature-center-inc/	OK
Appalachian Trail	https://appalachiantrail.org/	Discover the Appalachian Trail	Appalachian Trail Conservancy	The mission of the Appalachian Trail Conservancy is to protect, manage, and advocate for the Appalachian National Scenic Trail.	Open submenu (Explore the A.T.) | Explore the A.T. | Open submenu (Our Work) | Our Work | Open submenu (Get Involved) | Get Involved | Open submenu (News & Events) | News & Events | Shop | Trail Updates | Contact Us | Donate | GIVE MONTHLY | Close submenu (Explore the A.T.) | Explore the A.T.	a.t. volunteer opportunities, join todaybecome a memberas an atc member, you'll keep the trail alive with your support! plus, you'll get membership benefits like a subscription to our member magazine, discounts on farout a.t. trail guides, and a member discount in the atc trail store., become an a.t. stewardvolunteervolunteers are the heart and soul of the appalachian trail. we have plenty of opportunities for you to give back to the trail you love so much., volunteer, hurricane helene recoverywe've gathered the latest resources and information about ongoing clean up efforts for 2025 a.t. hikers and volunteers., support our workdonate todaywe rely on the generosity of donors like you to help us fulfill our mission and vision of protecting the appalachian trail., donate, give monthly, ways to give	https://connect.clickandpledge.com/w/Form/79420bd0-a13c-4189-98aa-dda5cab8fd0e?638748783565447750	Other	https://appalachiantrail.org/news-events/newsletters/	https://wildeast.appalachiantrail.org/events/	https://wildeast.appalachiantrail.org/our-work/about-us/board-leadership/	https://www.facebook.com/ATHike	https://www.instagram.com/appalachiantrail/	https://www.youtube.com/user/atconservancy	https://www.linkedin.com/company/appalachian-trail-conservancy	OK
1000 Friends	https://1kfriends.org/	1000 Friends of Wisconsin	1000 Friends of Wisconsin - the Land Use Institute	We promote land use policies & activities that advance healthy communities, natural resources protection & environmental benefits in Wisconsin.	Skip to content | 1000 Friends of Wisconsin | About Us | Mission & Vision | How We Are Different | History | Testimonials | Staff | Board of Directors | Annual Reports/Financials | What We Do | Climate Change | Community Transportation Academy | Land Use Planning | Transportation	join our mailing list, donate now, other ways to give, 1k friends supports policies to create more housing in madison	https://donorbox.org/donate-1kfriends	Other		https://1kfriends.org/category/events/	https://1kfriends.org/board-of-directors/	https://www.facebook.com/1kfriends	https://www.instagram.com/1kfriends/	https://www.youtube.com/user/1000FriendsWisconsin	https://www.linkedin.com/company/1000-friends-of-wisconsin/	OK
Wisc Wildlife Foundatoin	https://wiwf.org/cdnwiwf/	Wisconsin Wildlife Federation	Home Page - Wisconsin Wildlife Federation		Skip to content | Purchase your 2024 Wisconsin Wildlife Federation Raffle Calendar HERE | Purchase your 2024 Wisconsin Wildlife Federation Raffle Calendar HERE | Click Here | Click Here | Wisconsin Wildlife Federation | Menu | Home | WISCONSERVATION E-MAG | Current Issue | News | Free E-Mag Subscription | Awards | Awards Criteria | Nomination Form	donate	/cdnwiwf/make-a-donation-to-wwf/	Other	/cdnwiwf/subscriber-agreement-and-terms-of-use/	/cdnwiwf/conservation-calendar-raffle-program/	/cdnwiwf/officers-staff-and-board/	https://www.facebook.com/WisconsinWildlifeFederation/		https://www.youtube.com/channel/UCbSFLqwuUWoxiotnvwcuanA		OK
Wisconsin Wetlands	https://www.wisconsinwetlands.org/		Wisconsin Wetlands Association		About | Mission | Our story | How We Work | Board of Directors | Staff | Reports and financials | Contact | Learn | About wetlands | Wetlands 101 | Types of wetlands | Benefits of wetlands | Explore Wisconsin’s wetlands | For landowners	donate today, support, join us, renew membership, ways to give, donate, give a gift of stock, give via your ira	https://www.wisconsinwetlands.org/ways-to-give/	Other			https://www.wisconsinwetlands.org/jobs-board/	https://www.facebook.com/WisconsinWetlands				OK
Wisconsin's Greenfire	https://wigreenfire.org/	Our Work	Wisconsin's Green Fire • Wisconsin’s Green Fire	Wisconsin’s Green Fire supports our conservation legacy by promoting science-based management of natural resources.	Skip to content | Support Our Work | About | About Wisconsin’s Green Fire | Who We Are | Staff | Board of Directors | WGF Ambassadors | Science Council | Work Groups | Land Acknowledgement Statement | Our Conservation Priorities | Annual Reports | Our Work | Latest Work	support our work, wgf joins nitrate watch program, news release: wgf supports audit findings that confirm the wdnr properly managed fish and wildlife account funds, join usin advancing science-based conservation in wisconsin., support wgf today - donate and become a member, become a member support our work, click here to donate online, click here for more ways to give, become a supporter of wisconsin's green fire today!	https://wigreenfire.org/make-a-difference/support-our-work/	Other	https://wigreenfire.org/newsletters/	https://wigreenfire.org/events/	https://wigreenfire.org/board-of-directors/	https://www.facebook.com/wigreenfire	https://www.instagram.com/wisgreenfire/	https://www.youtube.com/@wisconsinsgreenfire6408	https://www.linkedin.com/company/wisconsin-s-green-fire-inc	OK
Waukesha Conservation	https://waukeshalandconservancy.org/		Waukesha County Land Conservancy Website	A nonprofit land trust protecting and caring for environmentally significant land and water in Waukesha County for future generations.	Home | About Us | Annual Report | Our Preserves | Our Easements | Events | Volunteer | Hunt | Shop | Giving | Membership | CONTACT US | sign up for news | Support Conservation | Learn more	support conservation, volunteer with us, volunteer				#page-3						OK
Ulao Creek	https://www.ulaocreek.org/		Ulao Creek Partnership		0 | Skip to Content | Ulao Creek Partnership | HOME | ABOUT | PROJECTS | PARTNERS | FAQs & RESOURCES | CONTACT | DONATE/ JOIN | Ulao Creek Partnership | HOME | ABOUT | PROJECTS | PARTNERS	donate/ join, volunteer and join	/donate-join	Other				https://www.facebook.com/4lnrp?__cft__[0]=AZU5gs2xcU9LTGtO6KisVX1BMi1ZUPi3On6jzEyf-B3W7nCc09JMNMe0c0_3WXKz9YgB-cd0oBGCWfZGWs0LRekP7uU-sJIFA7DGtcIGho8Ld9cb0RKrllBnbC1DaxFTlk2liAkGsI4tq2i2HEr7XRiSm9N7n_mR2DcxGprhTniSLgssJIu9NVPP-Mtv9VVh-uQSN2QSIrhKKdQr3SuJM4EH657O-DrjTLTdGa0o2r-ZG3ecIlFuBr47GcThqp2iQHo&__tn__=-]K-R				OK
Wisconsin Trout	https://wicouncil.tu.org/	Wisconsin Council of Trout Unlimited	Home - Wisconsin Council	Caring for and recovering Wisconsin's cold water lakes & rivers and the trout that call them home	Skip to content | Wisconsin Council | Get Involved | Support Our Work | Attend An Event | Volunteer Locally | Wisconsin TU License Plates | Programs and Activities | Conservation & Restoration | Youth Education | Community Activities | Friends of Wisconsin TU Grant Program | Watershed Access Program | 2026 Wisconsin Trout Unlimited Banquet | About Us	support our work, volunteer locally, join, donate	https://wicouncil.tu.org/donate/	Other	https://wicouncil.tu.org/about-us/wisconsin-trout-newsletter/	/get-involved/attend-an-event/						OK
Ruffed Grouse Society	https://ruffedgrousesociety.org/	RGS	RGS – Healthy Forests, Abundant Wildlife, Conservation Ethic	Healthy Forests, Abundant Wildlife, Conservation Ethic	JOIN | DONATE | Skip to primary navigation | Skip to main content | Skip to footer | RGS | Give | Donate | Planned Giving | Get Involved | Events | Subscribe | Get to Know Your Region | Northeast | Mid-Atlantic	donate today, join, join / renew, donate, give, join or renew today, join rgs & aws	https://www.uplandstore.org/products/donation	Other	https://ruffedgrousesociety.org/welcome-to-the-bellwether/	https://ruffedgrousesociety.org/events/	https://ruffedgrousesociety.org/rgs-aws-staff/	https://www.facebook.com/RuffedGrouseSociety	https://www.instagram.com/RuffedGrouseSociety/	https://www.youtube.com/RuffedGrouseSociety		OK
Rails to Trails	https://www.railstotrails.org/		Rails to Trails Conservancy: Building A Nation Connected By Trails | Rails to Trails Conservancy	Rails to Trails Conservancy is building a nation connected by trails, reimagining public spaces to create safe ways to be active outdoors.	Skip to content | TrailLink | Great American Rail-Trail | TrailNation Summit | TrailBlog | Press Room | My Account | Logout | Find Trails | Shop | Donate | Renew | Donate | Find Trails | Shop	donate today, support great american rail-trail, join the trailnation collaborative for advocates and professionals working on trail networks, membership & other ways to give, renew membership, join the trailnation collaborative, donate, renew, supporting trail builders, ways to support rtc, support trails	https://secure.railstotrails.org/site/Donation2?df_id=14366&mfc_pref=T&14366.donation=form1&s_src=website&s_subsrc=nav-button	Other	https://secure.railstotrails.org/site/Donation2?df_id=13282&mfc_pref=T&13282.donation=form1&s_src=website&s_subsrc=nav		https://www.railstotrails.org/about/staff/	https://www.facebook.com/railstotrails	https://instagram.com/railstotrails	https://www.youtube.com/c/RailstoTrailsConservancy	https://www.linkedin.com/company/railstotrails/	OK
Riverland	https://riverlandconservancy.org/	RIVERLAND CONSERVANCY	Home - Riverland Conservancy	"We accomplish our mission through three main initiatives: Education, Stewardship, and Partnerships 

Our 1,642-acre preserve located in southcentral Wisconsin is a peaceful oasis for wildlife and people alike. 

Our 200-acre preserve located along the Mississippi River in northeast Iowa features rugged cliffs and soaring eagles. 

If you like our work and want to help, make"	Skip to content | HOME | ABOUT US | WHAT WE DO | WHO WE ARE | UPCOMING EVENTS | MERRIMAC | DESCRIPTION | VISITING | LANSING | CONTACT | DONATE | HOME | ABOUT US | WHAT WE DO	support us, donate	https://riverlandconservancy.org/donate/	Other		https://riverlandconservancy.org/upcoming-events/						OK
LNRP	https://www.lnrp.org/	We all live on the water…	Lakeshore Natural Resource Partnership	"We seek to cultivate community & stewardship for natural resources from the 
Ledge to the Lakeshore in Northeast Wisconsin."	MISSION | VISION | OUR STORY | Our Impact | PARTNERS | BOARD | STAFF | JOIN OUR TEAM | GET INVOLVED | Volunteer | News + Updates | Why LNRP? | Coastal Resilience Project | Coastal Resource Hub | RESOURCES	other ways to support, support, volunteer, give today, join our team					/team/#joinourteam	https://www.facebook.com/4lnrp	https://www.instagram.com/4lnrp/	https://www.youtube.com/@4LNRP		OK
Great Headwaters	https://ghtrails.org/		Great Headwaters Trails Foundation, Inc. – Family Friendly Hiking & Biking		Skip to content | Trail System | What is the GHTF System? | Plans and Progress | Community Benefits | Conover-Phelps Trail | Eagle River City Connector | River Trail | Eagle River-Conover Trail | Conover-Land O’ Lakes Trail | News & Events | News | E-Newsletters | Ride with Leinie 2025 | SepTimber Ride 2025	vilas county news-review: connector bike trail gets fresh paint; volunteers install bollards for season, vilas county news review: cloverland board unanimously re-pledges support for river trail project, volunteer opportunities, donate, donate today!, volunteer today!	https://ghtrails.org/donate/	Other	https://ghtrails.org/enewsletters/	https://ghtrails.org/ght-news/	https://ghtrails.org/board-2/	https://www.facebook.com/ghtrails		https://www.youtube.com/channel/UC2tonVl51uJIHKYhy9ZYhJQ		OK
Chippewa Conservancy	https://www.chippewaconservancy.org/	Conservingnatural landin Chippewa County for everyone and Earth	Chippewa County Land Conservancy	"Chippewa County Land Conservancy is a non-profit land trust, or 
environmental conservation organization, conserving land in Chippewa 
County, Wisconsin."	0 | Skip to Content | Home | Volunteer | Events | Preserves | Blog | About | Contact | Donate | Home | Volunteer | Events | Preserves | Blog	volunteer with us, volunteer, plant hike with an herbalist—join us!, donate, a word of thanks to a special volunteer	/donate	Other	/s/Field-Notes-2023.pdf	/events	/field-notes/ti014htv4rzlnic1hi6sx0oz5xi52f	https://www.facebook.com/chippewaconservancy	https://www.instagram.com/chippewaconservancy/			OK
Baraboo Range	https://www.baraboorange.org/	The Baraboo Range Preservation Association is a land trust which works to preserve and protect the qualities and culture of the Baraboo Range through promotion of ecologically responsible land use.  We achieve our mission through collaboration with groups having similar goals, community education, and land protection projects.	Baraboo Range Preservation Association	A local land trust preserving and protecting the qualities and culture of the Baraboo Range	Home | About | Executive Director Position | Board of Directors | Board Member Login | Staff | History | Donation | Lecture Series | 2024 Series | 2023 Series | 2022 Series | 2021 Series | Land Protection | Conservation Easements	donate	https://www.baraboorange.org/donation	Other			https://www.baraboorange.org/staff	https://www.facebook.com/BarabooRange/				OK
Wisconservation	https://www.wisconservation.org/		Natural Resources Foundation of Wisconsin	Natural Resources Foundation of Wisconsin provides funding for Wisconsin's lands, waters, and wildlife and environmental education.	2021-2023 Strategic Plan | About | 2019 C.D. Besadny Conservation Fund Awarded to 19 Organizations Across Wisconsin | Annual Reports & Financials | Anonymous half-million dollar donation creates hope for Wisconsin pollinators | Board of Directors | Bridges member magazine | Contact | Natural Resources Foundation of Wisconsin welcomes new Executive Director | News | Natural Resources Foundation of Wisconsin Welcomes New Executive Director | News Archives | Our Mission | Staff | Accessible Recreation	donate or join, how to give, join or renew, volunteer, join us, donate now, give, our supporters, bird protection fund announces plans to support wisconsin birds in 2020	https://donatenow.networkforgood.org/wisconservation	Network for Good	https://www.bonfire.com/store/natural-resources-foundation-of-wisconsin/?utm_source=Master%20List&utm_campaign=5bcec5e61d-EMAIL_CAMPAIGN_2020_09_07_07_30_COPY_01&utm_medium=email&utm_term=0_72d6771e0d-5bcec5e61d-	https://www.wisconservation.org/elpevents/	https://www.wisconservation.org/about-us/board-of-directors/	https://www.facebook.com/NaturalResourcesFoundation	https://www.instagram.com/wisconservation/	https://www.youtube.com/@Wisconservation	https://www.linkedin.com/company/natural-resources-foundation-of-wisconsin/?viewAsMember=true	OK
Truckee Land Trust	https://www.truckeedonnerlandtrust.org/		Truckee Donner Land Trust		Our Story | Projects | WAYS TO GIVE | How To Help | News & Events | Explore | How To Help | News & Events | Explore | Our Story | Projects | WAYS TO GIVE | MAKE RESERVATIONS | READ MORE | LEARN MORE	ways to give				/news-events		https://www.facebook.com/truckeedonnerlandtrust/	https://www.instagram.com/truckeedonnerlandtrust/			OK
Golden Gate Parks Conservancy	https://www.parksconservancy.org/	Help keep GGNRA beaches beautiful	Golden Gate National Parks Conservancy: Parks For All Forever | Golden Gate National Parks Conservancy		Skip to main content | Learn more | Lands End Lookout Temporary Closure | Join the massive statewide effort | Coastal Clean-up Day | Get Trails Forever Dinner tickets | An unforgettable Lands End evening | Visit Alcatraz Now | Alcatraz: More than a landmark. | Learn more | Lands End Lookout Temporary Closure | Join the massive statewide effort | Coastal Clean-up Day | Get Trails Forever Dinner tickets | An unforgettable Lands End evening	group volunteer programs, specialized volunteer roles, volunteer, give today, join the volunteer effort, volunteer opportunities, donate, give monthly, community volunteer programs, join the massive statewide effort	https://secure.parksconservancy.org/site/Donation2?df_id=8480&mfc_pref=T&8480_donation=form1&config_id=&s_src=web&s_subsrc=nav_button&utm_source=nav_button&utm_medium=web&utm_campaign=web	Other		https://www.parksconservancy.org/events	/about/board-trustees	https://www.facebook.com/parksconservancy	http://instagram.com/parksconservancy	http://www.youtube.com/parksconservancy?sub_confirmation=1		OK
Keweenaw Land Trust	https://keweenawlandtrust.org/	Stewardship work on our protected lands	Home | Keweenaw Land Trust	Summary text here.	Skip to main content | ~Give~ | Who we are | Mission & Values | Our Staff & Board | Accreditation | Publications | Our Partners | What we do | All Protected Lands | Land Conservation | Land Stewardship | Education and Outreach | Visit | Overview & Map	~give~, volunteer, support our work			/get-email-updates	/upcoming-events	/kltea-time-board-director-edition-september-5-400pm-600pm	https://www.facebook.com/KeweenawLandTrust/			https://www.linkedin.com/company/keweenaw-land-trust	OK
Land Trust Alliance	https://landtrustalliance.org/		Land Trust Alliance		Why Land Matters | Why Land Matters | Land conservation | About land trusts | What's at stake | Land is the answer | About private land conservation | Conservation priorities | Clean water | Climate change | Equitable land access | Future generations | Family farms and ranches | Habitat conservation | Healthy communities	volunteer, supporting land trusts, supporter benefits, donate now, donate, give, give monthly, join stewards of the land, land trusts with volunteer opportunities, ways to give	https://gaininggroundusa.donorsupport.co/-/XXYZQDKS	Other			/job-board	https://facebook.com/landtrustalliance	https://instagram.com/ltalliance	https://youtube.com/user/LandTrustAlliance	https://linkedin.com/company/land-trust-alliance	OK
