Organization	URL	H1	MetaTitle	MetaDescription	NavItems	CTAs	DonateURL	DonationProvider	NewsletterURL	EventsURL	StaffBoardURL	Facebook	Instagram	YouTube	LinkedIn	Status
Sierra Club	https://www.sierraclub.org/	Fight for the Planet	Home | Sierra Club		Menu | Skip to main content | DONATE | Jacksonport, WI | View all chapters | Turn location off | Login | Shop | Join | Renew | About Us | Explore Issues | Climate | Fossil Fuels | Pipelines	give now, volunteer, join, give now >>, renew membership, donate, renew, give monthly, renewable energy, ways to give	https://act.sierraclub.org/donate/rc_connect__campaign_designform?id=701Po000016lFnjIAE&formcampaignid=7010Z000002B03qQAC&utm_campaign=giving&ddi=N25JOTF001	Other				https://facebook.com/sierraclub	https://instagram.com/sierraclub	https://www.youtube.com/user/NationalSierraClub	https://www.linkedin.com/company/sierraclub/	OK
Whales and Dolphins	https://uk.whales.org/	Who we are	Home - Whale and Dolphin Conservation	WDC, Whale and Dolphin Conservation is the leading global charity dedicated to the conservation and protection of all whales, dolphins and porpoises. Donate or adopt today.	Skip to content | Donate | Adopt | Search | Home | Whales and dolphins | Species guide | Facts and figures | Whales are climate giants | Whale culture | How to be a whale | Whale and dolphin watching | WDC publications and reports | What we do | Stop cruelty	volunteering, donate	https://uk.whales.org/support/donate/	Other	https://uk.whales.org/newsletter/?enl=referrer_fixed&ref=WM-WDCW-20-00-00-ENL	https://uk.whales.org/support/challenge-events/	https://uk.whales.org/the-team/	https://www.facebook.com/whalesorg	https://www.instagram.com/whalesorg/	https://www.youtube.com/whalesorg	https://www.linkedin.com/company/whale-and-dolphin-conservation	OK
Missouri Land Trust	https://missourilandtrusts.org/	Missouri Land Trust Coalition	Missouri Land Trust Coalition - Protecting Land in Missouri	Missouri Land Trust Coalition is an association of land trusts, working to conserve a wide variety of landscapes across Missouri.	Skip to content | |Members » | Home | Who We Are | MLTC – Who We Are | About Missouri Land Trust Coalition | Member Land Trusts | Associate Members | Where We Work | v | START HERE » | About Land Trusts | About Land Trusts | About Land Trusts | What is a Land Trust?							https://www.facebook.com/profile.php?id=100087254721093	https://www.instagram.com/molandtrusts/	https://www.youtube.com/channel/UCKrFUufsnjopAADJyTxcoTQ		OK
Indiana Land Protection Alliance	https://www.protectindianaland.org/		Indiana Land Protection Alliance - ILPA	Indiana Land Protection Alliance is a network of nonprofit land trusts working together to conserve land throughout the state.	Skip to main content | Home | Our Work | About ILPA | Strategic Plan | Indiana Bioinventory Grant | Discover Your Land Trust | Indiana Land Trusts | About Land Trusts | Service Area Map | Land Protection Options | Get Involved | How to Get Involved | Visit a Preserve | Indiana Wetlands Challenge	join a hike, donate	https://www.protectindianaland.org/donate/	Other		/category/news	https://www.protectindianaland.org/ilpa-team/					OK
Greenbelt	https://www.ecga.org/	Protecting Land & Nature	Protecting Land & Nature - Greenbelt		Skip to main content | Things To Do | Events | Explore | Families | Virtual Tours | Community Gardens | Policies & FAQs | Conservation | Conserve Your Land | Recent Success Stories | Current Projects | Caring for the Land | Farmland Conservation | Our Conservation Partners	volunteer, more ways to give…, support greenbelt’s annual fund, volunteer opportunities, donate	/support/donate	Other	/about/publications/signup	/events	/about/staff	https://www.facebook.com/ECGreenbelt/	https://www.instagram.com/ecgreenbelt/	https://www.youtube.com/@EssexCountyGreenbelt	https://www.linkedin.com/company/essex-county-greenbelt-association	OK
Mass Audubon	https://www.facebook.com/thetrustees	The Trustees	The Trustees | Boston MA | Facebook	The Trustees, Boston. 48,752 likes · 380 talking about this · 146 were here. We love the outdoors. We love Massachusetts’ special places. And we...	Log In | Forgot Account? | 54Kfollowers | 255following | Posts | About | Reels | Photos | The Trustees | http://www.thetrustees.org | thetrustees.org/places | 96% recommend (80 Reviews)﻿ | Photos | See all photos | Privacy							https://www.facebook.com/login/device-based/regular/login/?login_attempt=1&next=https%3A%2F%2Fwww.facebook.com%2Fthetrustees				OK
